{
  "schemaVersion": 1,
  "teamId": "strength-app",
  "startedAt": "2026-09-25T20:00:00Z",
  "endedAt": "2026-09-25T20:02:03Z",
  "outcome": "done",
  "agents": [{ "agentId": "builder", "state": "done" }],
  "grantsUsed": [
    { "grantId": "sa-git-read", "count": 6 },
    { "grantId": "sa-notion-read", "count": 1 },
    { "grantId": "sa-ledger-write", "count": 1 }
  ],
  "ledger": { "changed": true, "linesAdded": 1, "linesRemoved": 0 }
}
