{
  "schemaVersion": 1,
  "teamId": "strength-app",
  "startedAt": "2026-09-26T08:00:00Z",
  "endedAt": "2026-09-26T08:04:40Z",
  "outcome": "failed",
  "error": "pnpm test: 1RM calculator rounding test failed (expected 102.5, got 102.49)",
  "sessionUrl": "https://claude.ai/code/session_01DEMO000000000000000003",
  "agents": [{ "agentId": "builder", "state": "failed", "note": "tests red, build not cut" }],
  "grantsUsed": [
    { "grantId": "sa-git-read", "count": 5 },
    { "grantId": "sa-ledger-write", "count": 1 }
  ],
  "ledger": { "changed": true, "linesAdded": 1, "linesRemoved": 0, "summary": "logged the failure" }
}
